title,overview,release_date,year,top_genre
Fright Night,"Nobody believes teenager Charley Brewster when he discovers that his suave new neighbor, Jerry Dandrige, is a vampire. So when the bloodsucker starts stalking Charley, he turns to has-been actor Peter Vincent, famed for portraying a ghoul hunter. Unfortunately for the would-be vampire slayers, Dandrige has set his sights on Charley's girlfriend.",1985-08-02,1985,Horror
Devilman Volume 3: Devilman Apocalypse,"Fear runs rampant throughout Tokyo with the revelation that demons in fact exist amongst us. Paranoia and the darker side of humanity boils onto the streets as people turn on one another, suspecting that anyone could in fact be a demon hiding in human clothing. Amidst the growing tensions, tragedy strikes Akira causing his mind to snap, retreating into his subconscious, allowing his Devilish alter-ego Amon to break free from Akira's cage of flesh and wreak havoc on both human and demons alike.",2000-04-24,2000,Horror
It's Gradiva Who Is Calling You,An English historian travels to Morocco to work on a study of the painter Delacroix. He hears of a rare series of engravings and embarks on a search for them that takes him through the mysterious streets of the ancient medina. He becomes obsessed with the figure of a beautiful blond woman dressed in white that he sees there. but it appears that she may have died years before.,2007-05-09,2007,Horror
Criminal Lovers,"After a perverted impulse drives them to kill, Alice and her boyfriend, Luc, drag the body into the woods, only to find themselves hopelessly lost – much like the fairy-tale plight of Hansel and Gretel. Starving and with no hope of being found, they chance upon a dilapidated cottage where a hulking man takes them prisoner and proceeds to feed Luc's sexual appetite.",1999-08-17,1999,Horror
Be My Cat: A Film for Anne,An aspiring Romanian filmmaker obsessed with Hollywood actress Anne Hathaway goes to shocking extremes to convince Anne to star in his upcoming film.,2015-03-01,2015,Horror
Guilty of Romance,A detective probes the brutal murder of a woman in a red light district while a housewife hides her double life as a prostitute from her husband.,2011-01-21,2011,Horror
The Fearless Vampire Killers,"A noted professor and his dim-witted apprentice fall prey to their inquiring vampires, while on the trail of the ominous damsel in distress.",1967-02-01,1967,Horror
The Mad Magician,"Don Gallico is an inventor of stage magic effects who aspires to become a star in his own right. Just before his first performance his act is shut down by capricious manager Ross Ormond who wants Gallico's brilliant buzz saw effect for the act of The Great Rinaldi, an established star. With this defeat, and the humiliation of having already lost his wife Claire to Ormond, Gallico decides it is time to take matters into his own hands.",1954-05-19,1954,Horror
The American Nightmare,"An examination into the nature of 1960's-70's horror films, the involved artists, and how they reflected contemporary society.",2000-09-11,2000,Horror
The Big Shave,"This short film is a metaphor for the Vietnam War. A man walks into a meticulously clean and sterile bathroom, concentrating on the polished porcelain and shiny metal motif. He then proceeds to shave. When his face is clean, however, he only continues to shave until he pierces through his skin. Blood covers him and falls around him, the red contrasting the perfect spotlessness of the bathroom.",1967-12-29,1967,Horror
Baxter,"A white Bull Terrier named Baxter is given to an elderly woman by her daughter. As time passes, the dog develops aggressive and murderous behavior in order to be adopted by another family.",1989-01-18,1989,Horror
Audition,"Seven years after the death of his wife, company executive Aoyama is invited to sit in on auditions for an actress. Leafing through the resumés in advance, his eye is caught by Yamazaki Asami, a striking young woman with ballet training.",2000-03-03,2000,Horror
Dr. Jekyll and Mr. Hyde,A doctor's research into the roots of evil turns him into a hideous depraved fiend.,1920-03-18,1920,Horror
Treevenge,"Treevenge details the experiences and horrifying reality of the lives of Christmas trees. Clearly, for trees, Christmas isn’t the exciting “peace on earth” that is experienced by most. After being hacked down, and shipped away from their homes, they quickly become strung up, screwed into an upright position for all to see, exposed in a humiliation of garish decorations. But this Christmas will be different, this Christmas the trees have had enough, this Christmas the trees will fight back. Treevenge could be a short film about the end of days for Christmas trees, or perhaps, the end of humanity?",2008-07-07,2008,Horror
Gamera 3: Revenge of Iris,"This final installment of the recent Gamera trilogy begins with schoolgirl Ayana discovering a large egg in a cave that, according to legend, houses demons. The egg hatches into a small monster, which Ayana decides to raise and quickly develops a psychic bond with. As Ayana's monster, named Iris, grows to adulthood, the flying turtle Gamera begins to take an interest in this new potential threat. Who will be the victor in the final battle, and how much of Japan will be left standing at the end?",1999-03-06,1999,Horror
The Hitcher,"On a stormy night, young Jim, who transports a luxury car from Chicago to California to deliver it to its owner, feeling tired and sleepy, picks up a mysterious hitchhiker, who has appeared out of nowhere, thinking that a good conversation will help him not to fall asleep. He will have enough time to deeply regret such an unmeditated decision.",1986-02-21,1986,Horror
Blind Beast,"A blind sculptor and his mother kidnap a young woman and use her as a model. In the darkness of an abandoned warehouse, she suffers at the hands of the artist, eventually losing both her sight and her mind as whips give way to knives and knives give way to meat cleavers.",1969-01-25,1969,Horror
The Old Dark House,"Seeking shelter from a relentless rainstorm and landslides in a remote region of Wales, five travelers are admitted to a large foreboding old house that belongs to the extremely strange Femm family. Sepulchral Horace Femm and his obsessive, inhospitable sister Rebecca are the group's peculiar hosts. The house also holds surprises - and a brutish mute manservant named Morgan.",1932-10-20,1932,Horror
Day of the Dead,"Trapped in a missile silo, a small team of scientists, civilians and trigger-happy soldiers battle desperately to ensure the survival of the human race. However, the tension inside the base is reaching a breaking point, and the zombies are gathering outside.",1985-07-19,1985,Horror
Manhunter,"FBI Agent Will Graham, who retired after catching Hannibal Lecktor, returns to duty to engage in a risky cat-and-mouse game with Lecktor to capture a new killer.",1986-08-14,1986,Horror
"Kill Baby, Kill",An 18th century European village is haunted by the ghost of a murderous little girl.,1966-07-08,1966,Horror
Viy,A young priest is ordered to preside over the wake of a witch in the church of a remote village. This means spending three nights alone with the corpse with only his faith to protect him.,1967-11-27,1967,Horror
Taste of Fear,"A wheelchair-bound young girl returns to her father's estate after ten years, and although she's told he's away, she keeps seeing his dead body on the estate.",1961-06-05,1961,Horror
Neo Tokyo,"Three shorts directed by the same names that brought you Metropolis, Ninja Scroll, and Akira. It begins with “Labyrinth Labyrinthos”, a story of a maze in a child's mind, directed by Rintaro. Next Yoshiaki Kawajiri gives us “The Running Man”. This is a futuristic formula one race is set on a deadly track. Lastly Katsuhiro Ôtomo describes a struggle to shut down an entirely automated facility in “Construction Cancellation Order“.",1989-04-15,1989,Horror
Witchcraft,"When her grave is disturbed by modern-day land developers, a 300-year-old witch is accidentally resurrected and terrorizes an English village.",1964-03-01,1964,Horror
The California Kid,A sadistic small-town sheriff has a habit of deliberately forcing speeders to their deaths on the mountain roads leading into town. The brother of one of the victims rolls into town in his hot rod to investigate his brother's death.,1974-09-25,1974,Horror
Whistle and I'll Come to You,"A university professor, confident that everything which occurs in life has a rational explanation, finds his beliefs severely challenged when, during a vacation to a remote coastal village in Norfolk, he blows through an ancient whistle discovered on a beach, awakening horrors beyond human understanding.",1968-05-07,1968,Horror
Rocky Horror Show Live,"The Rocky Horror Show was born at the Royal Court's tiny Theatre Upstairs on June 16, 1973, and went on to become an international stage smash hit and a major motion picture.",2015-11-17,2015,Horror
The Spider Labyrinth,"A young professor travels to Budapest to locate a lost colleague. Once there, he gets tangled up in a supernatural mystery.",1988-08-25,1988,Horror
The Body Tree,"A group of Americans travel to Siberia where a friend died stabbed. Soon, they will discover their hosts are involved in the occult.",2017-11-13,2017,Horror
Us,"Husband and wife Gabe and Adelaide Wilson take their kids to their beach house expecting to unplug and unwind with friends. But as night descends, their serenity turns to tension and chaos when some shocking visitors arrive uninvited.",2019-03-14,2019,Horror
The Curse of Frankenstein,Baron Victor Frankenstein has discovered life's secret and unleashed a blood-curdling chain of events resulting from his creation: a cursed creature with a horrid face — and a tendency to kill.,1957-06-25,1957,Horror
Sleep Tight,"César, an unhappy concierge, maintains a peculiar relationship with the very diverse inhabitants of the upper-class apartment building where he works in Barcelona.",2011-10-14,2011,Horror
The Uninvited,A brother and sister move into an old seaside house they find abandoned for many years on the English coast. Their original enchantment with the house diminishes as they hear stories of the previous owners and meet their daughter (now a young woman) who now lives as a neighbor with her grandfather. Also heard are unexplained sounds during the night. It becomes obvious that the house is haunted.,1944-02-18,1944,Horror
Good Manners,"Clara, a lonely nurse from the outskirts of São Paulo, is hired by mysterious and wealthy Ana as the nanny for her unborn child. The two women develop a strong bond, but a fateful night changes their plans.",2017-08-04,2017,Horror
Drácula,"In the early days of sound, it was common for Hollywood studios to produce Hollywood foreign-language versions of their films (usually in French, Spanish and German) using the same sets, costumes and etc. Unfortunately, most of these foreign language versions no longer exist. The Spanish version of Dracula is an exception. In recent years this version has become more highly praised by some than the English language version. The Spanish crew had the advantage of watching the dailies from the English crew's version when they came in for the evening and they would figure out better camera angles and more effective use of lighting in an attempt to ""top"" it. As a result, this version's supporters consider it to be much more artistically effective.",1931-03-11,1931,Horror
The Strange Vice of Mrs Wardh,"Newly married to an older man, Julie returns to Vienna, where a razor wielding slasher is killing women. Jean, her cruel and sadistic former lover, immediately contacts her, certain that only he can satisfy her strange vice. But she rejects him. She also meets George, the handsome cousin of her friend Carol; both are newly rich, thanks to an uncle's death. Julie's husband Neil is away frequently, so George pours on the charm. Meanwhile, it seems that the slasher is now focused on Julie. Bodies pile up, other murders are barely avoided, and George invites her to go away with him. Can it end happily?",1971-01-15,1971,Horror
Friendly Beast,"A restaurant owner going over the edge when an armed robbery is attempted at his establishment. He holds everyone captive at gunpoint – criminals and customers alike – and situations corrode into a nightmare state, guided by manipulation and raw compulsion.",2018-08-09,2018,Horror
mother!,"A couple's relationship is tested when uninvited guests arrive at their home, disrupting their tranquil existence.",2017-09-13,2017,Horror
In a Glass Cage,"A Nazi doctor who had a fetish for young boys feels guilt after torturing and murdering his latest victim, and throws himself off a roof. Some years later, the doctor, confined to an iron lung, accepts as his nurse a boy who secretly witnessed that killing.",1987-03-03,1987,Horror
Halloween: 25 Years of Terror,"A documentary that follows the evolution of the 'Halloween' movies over the past twenty-five years. It examines why the films are so popular and revisits many of the original locations used in the films - seeing the effects on the local community. For the first time, cast, crew, critics and fans join together in the ultimate 'Halloween' retrospective",2006-07-26,2006,Horror
The Beyond,"When New Yorker Liza Merril inherits an old hotel in Louisiana and invests her savings to reopen the place, she doesn't realize that the hotel houses the body of a dead painter murdered decades earlier, nor that it's about to become a gateway to Hell.",1981-04-22,1981,Horror
The Telephone Box,A man gets trapped inside a telephone box and nobody is able to free him. The film won the 1973 International Emmy Award for Fiction.,1972-12-13,1972,Horror
Still Life,"A pill-popping, over-caffeinated driver accidentally hits something. Panic-stricken, he searches for help in a strange and desolate town that offers very little in the form of human kindness.",2005-09-10,2005,Horror
From Dusk Till Dawn,"Seth Gecko and his younger brother Richard are on the run after a bloody bank robbery in Texas. They escape across the border into Mexico and will be home-free the next morning, when they pay off the local kingpin. They just have to survive 'from dusk till dawn' at the rendezvous point, which turns out to be a Hell of a strip joint.",1996-01-19,1996,Horror
Mr. Vampire,"The planned reburial of a village elder goes awry as the corpse resurrects into a hopping, bloodthirsty vampire, threatening mankind. Therefore, a Taoist Priest and his two disciples attempt to stop the terror.",1985-11-07,1985,Horror
Season's Greetings,This animated twist on Halloween memories involves the traumatic theft of a candy bag on Halloween night.,1996-10-31,1996,Horror
The Fan,"The hero-worship that Simone has for a pop singer is built to a crescendo until she passes out when she finally sees him up-close in a crowd of fans pushing him for autographs. She is later shocked when he lets her know that he does not love her. In an instant, she is caught ""in a trance"" and feels a murderous urge that is bigger than the both of them.",1982-06-04,1982,Horror
The Spiral Staircase,"In 1916, beautiful young mute Helen is a domestic worker for elderly, ailing Mrs. Warren. Mrs. Warren's two adult sons, Albert (a professor) and womanizing impudent Steven, also live in the Warren mansion. Mrs. Warren becomes concerned for Helen's safety when a rash of murders involving 'women with afflictions' hits the neighborhood. She implores her physician, Dr. Parry, to take Helen away for her own safety. When another murder occurs inside the Warren mansion, it becomes obvious that Helen is in danger.",1946-02-06,1946,Horror
The Addams Family,"When an evil doctor finds out Uncle Fester has been missing for 25 years, he introduces a fake Fester in an attempt to get the Addams family's money. Wednesday has some doubts about the new uncle Fester, but the fake uncle adapts very well to the strange family.",1991-11-22,1991,Horror
Tetsuo: The Iron Man,"A ""metal fetishist"", driven mad by the maggots wriggling in the wound he's made to embed metal into his flesh, runs out into the night and is accidentally run down by a Japanese businessman and his girlfriend. The pair dispose of the corpse in hopes of quietly moving on with their lives. However, the businessman soon finds that he is now plagued by a vicious curse that transforms his flesh into iron.",1989-07-01,1989,Horror
Targets,"A Vietnam veteran quietly plans to go on a mass shooting spree. At the same time, an elderly horror film star prepares to make a public appearance at a drive-in theater.",1968-05-15,1968,Horror
The Ghost Breakers,"After intrepid working girl Mary Carter becomes the new owner of a reputedly haunted mansion located on Black Island near the Cuban coast, a stranger phones warning her to stay away from the castle. Undaunted, Mary sets sail for Cuba with a stowaway in her trunk—wise-cracking Larry Lawrence, a radio announcer who helps Mary get to the bottom of the voodoo magic, zombies and ghosts that supposedly curse the spooky estate.",1940-06-21,1940,Horror
Hellraiser,An unfaithful wife encounters the zombie of her dead lover while the demonic cenobites are pursuing him after he escaped their sadomasochistic underworld.,1987-09-11,1987,Horror
From Beyond the Grave,"Four customers purchase (or take) items from Temptations Limited, an antiques shop whose motto is ""Offers You Cannot Resist"". A nasty fate awaits all of them—particularly those who cheat the shop's Proprietor.",1974-02-23,1974,Horror
The Mummy,An ancient Egyptian priest named Imhotep is revived when an archaeological expedition finds his mummy and one of the archaeologists accidentally reads an ancient life-giving spell. Imhotep escapes from the field site and searches for the reincarnation of the soul of his lover.,1932-12-22,1932,Horror
The Lodge,"Two siblings spend the night alone with their new stepmother. Stuck in a remote mountain cabin, the trio are terrorised by a supernatural force.",2019-12-06,2019,Horror
Doppelganger,Hayasaki is an inventor working on an Artificial Body. It is not going well and he is stressed out and on the verge of being fired from the research division of his company. His doppelgänger appears to help him out of the rut he has created for himself.,2003-09-27,2003,Horror
The Last Little Red Riding Hood,"A old red riding hood, badly crippled after killing a monster many years ago, comes up with a sinister plan to dance again.",1996-01-01,1996,Horror
Before I Hang,"A physician on death row for a mercy killing is allowed to experiment on a serum using a criminals' blood, but secretly tests it on himself. He gets a pardon, but finds out he's become a Jekyll-&amp;-Hyde.",1940-09-17,1940,Horror
Saw,"Saw is an Australian nine-and-a-half-minute short subject horror film that was later expanded to a full feature film. The story is about David, an orderly at a hospital, who tells his horrific story of being kidnapped and forced to play a vile game of survival.",2003-01-01,2003,Horror
Short Night of Glass Dolls,An American journalist in Prague searches for his girlfriend who has suddenly disappeared.,1971-10-21,1971,Horror
House on Haunted Hill,"Frederick Loren has invited five strangers to a party of a lifetime. He is offering each of them $10,000 if they can stay the night in a house. But the house is no ordinary house. This house has a reputation for murder. Frederick offers them each a gun for protection. They all arrived in a hearse and will either leave in it $10,000 richer or leave in it dead!",1959-02-17,1959,Horror
Bleeder,"Two stories for the price of one: Lenny works in a video shop and tries to get acquainted with the waitress Lea. Leo can't cope with the pressure of becoming a father, leading to trouble with his pregnant wife and especially her brother.",1999-08-06,1999,Horror
Mystery of the Wax Museum,"Sculptor Ivan Igor struggles in vain to prevent his partner from burning his wax museum, and his ""children"". Years later, Igor starts a new museum in New York, but his maimed hands confine him to directing lesser artists. People begin disappearing; Igor takes a sinister interest in Charlotte, fiancée of his assistant Ralph, but arouses the suspicions of roommate, wisecracking reporter Florence.",1933-02-18,1933,Horror
Suspiria,"A darkness swirls at the center of a world-renowned dance company, one that will engulf the troupe's artistic director, an ambitious young dancer and a grieving psychotherapist. Some will succumb to the nightmare, others will finally wake up.",2018-10-11,2018,Horror
House of Wax,"A New York sculptor who opens a wax museum to showcase the likenesses of famous historical figures runs into trouble with his business partner, who demands that the exhibits become more extreme in order to increase profits.",1953-04-10,1953,Horror
The Living and the Dead,"A descent into Hell is triggered when ""Ex-Lord"" Donald Brocklebank finds that he must leave Longleigh House for London to find a way to pay for the medical treatments for his wife Nancy. Alone, his over-protected, delusional, adult son, James, fancies himself in charge of the manor house with his terminally ill mother, and barricades the two of them into the house.",2006-09-23,2006,Horror
The Scarlet Claw,A woman is found dead -- with her throat torn out. Villagers blame a supernatural source but Holmes has other ideas.,1944-05-26,1944,Horror
The Last Time I Saw Richard,"A troubled young man at a mental health institution gets a quiet new roommate. The pair become close friends, bonded over a mutual threat that may or may not be real.",2013-06-15,2013,Horror
10 Cloverfield Lane,"After getting in a car accident, a woman is held in a shelter with two men, who claim the outside world is affected by a widespread chemical attack.",2016-03-10,2016,Horror
Witch's Cradle,Witch’s Cradle is an unfinished Maya Deren film made in the Guggenheim Gallery during a surrealist “Art of this Century” exhibit. It was assembled long after her death by staffers within the preservation department at Anthology Film Archives.,1944-01-01,1944,Horror
Ju-on: The Curse,"A teacher visits the house of one of his students after the boy goes missing, only to have a horrifying excuse for his absence from school.",2000-02-11,2000,Horror
Wicked City,"A peace treaty between the Earth and the Black World, a parallel universe of demons, is coming to an end. Two cops, Taki, a human male, and Maki, a female demon, are assigned to protect a diplomat who will help secure another treaty. A radical group of demons from the Black World are out to assassinate the diplomat and prevent the treaty; only the bond that forms between the two cops can save the Earth from destruction.",1987-04-19,1987,Horror
The Hound of the Baskervilles,"When a nobleman is threatened by a family curse on his newly inherited estate, detective Sherlock Holmes is hired to investigate.",1959-05-04,1959,Horror
And Soon the Darkness,"Two young English women go on a cycling tour of the French countryside. When one of them goes missing, the other begins to search for her. But who can she trust?",1970-09-10,1970,Horror
"Butcher, Baker, Nightmare Maker","Rejected by her lover, the only man left in Cheryl's life is the orphaned nephew she has raised as her own son. She'll stop at nothing to keep Billy with her. When her plans misfire, she is swept up into an insane frenzy that means death to anyone who comes between her and her obsession. But the investigating detective is convinced that Billy is the real killer - and determined to prove it. Madness and fanaticism work together to drag all concerned into a terrifying vortex of blood-letting that adds a nightmarish twist to the classic Oedipus story.",1982-02-24,1982,Horror
What Ever Happened to Aunt Alice?,"As Aunt Alice, Ruth Gordon applies for the job of housekeeper in the Tucson, Arizona home of widow Claire Marrable in order to find out what happened to a missing widowed friend, Edna Tilsney. The crazed Page, left only a stamp album by her husband, takes money from her housekeepers, kills them, and buries the bodies in her garden. Alice is a widow too. So is neighbor Harriet Vaughn. Lots of widows here.",1969-08-20,1969,Horror
Hair High,"Bill Plympton's gothic '50s high-school comedy about a love-triangle that goes terribly wrong. Two murdered teens return from the grave, then go to their prom to get revenge.",2004-04-17,2004,Horror
Red Dragon,"Former FBI Agent Will Graham, who was once almost killed by the savage Hannibal 'The Cannibal' Lecter, now has no choice but to face him again, as it seems Lecter is the only one who can help Graham track down a new serial killer.",2002-09-29,2002,Horror
The Abominable Dr. Phibes,"Famous organist Anton Phibes is horribly disfigured in an automobile accident while rushing to the side of his sick wife and presumed to be dead. Once Phibes learns that his wife died on the operating table, he is convinced the doctors are responsible and begins exacting his revenge on all those involved.",1971-05-18,1971,Horror
Spellbound,A magician meets a weird girl and offers her to work together in his magic show. It's only until a year later that he starts to know her personally and develops a feeling towards her despite her own problems.,2011-12-01,2011,Horror
Firebase,"Set during the Vietnam war, Firebase follows American soldier Hines through an ever-deepening web of science fiction madness.",2017-06-28,2017,Horror
