title,overview,release_date,year,top_genre
Psycho,"When larcenous real estate clerk Marion Crane goes on the lam with a wad of cash and hopes of starting a new life, she ends up at the notorious Bates Motel, where manager Norman Bates cares for his housebound mother. The place seems quirky, but fine… until Marion decides to take a shower.",1960-06-22,1960,Horror
Sleep Has Her House,"The shadows of screams climb beyond the hills.  It has happened before. But this will be the last time.  The last few sense it, withdrawing deep into the forest.  They cry out into the black, as the shadows pass away, into the ground.",2017-01-01,2017,Horror
Antrum,"Rumored to have been lost, Antrum appears as a cursed film from the 1970s. Viewers are warned to proceed with caution. It’s said to be a story about a young boy and girl who enter the forest in an attempt to save the soul of their recently deceased pet. They journey to “The Antrum,” they very spot the devil landed after being cast out of heaven. There, the children begin to dig a hole to hell.",2018-10-14,2018,Horror
The Silence of the Lambs,"Clarice Starling is a top student at the FBI's training academy. Jack Crawford wants Clarice to interview Dr. Hannibal Lecter, a brilliant psychiatrist who is also a violent psychopath, serving life behind bars for various acts of murder and cannibalism. Crawford believes that Lecter may have insight into a case and that Starling, as an attractive young woman, may be just the bait to draw him out.",1991-02-01,1991,Horror
House of the Disappeared,"After 25 years of imprisonment for familicide, a mother comes back home where her son disappeared.",2017-04-05,2017,Horror
Mr. Vampire 3,"The Vampire Master joins forces with another fellow priest (with his two pet ""ghosts"" along for the ride) to defeat an evil witch and her henchman, whose goals are to defeat the human race. The priests must also overcome the odds of the separation between humans and ghosts.",1987-12-17,1987,Horror
The Shining,"Jack Torrance accepts a caretaker job at the Overlook Hotel, where he, along with his wife Wendy and their son Danny, must live isolated from the rest of the world for the winter. But they aren't prepared for the madness that lurks within.",1980-05-22,1980,Horror
Ghost Adventures,"In 2007, The Sci-Fi Channel premiered ""Ghost Adventures,"" a raw documentary in which 3 men go to Virginia City, NV and Goldfield, NV on a ghost hunting expedition. Virginia City is rife with macabre lore and reputed to be one of the most haunted cities in America. Ghost Adventures has won a Grand Jury Prize for Best Documentary that was given by the New York International Film &amp; Video Festival.",2007-07-25,2007,Horror
Demons,"Gengobe Satsuma, an exiled samurai cast out as an Asano clan retainer is given a second chance to join his brothers in arms to become the 48th Ronin against the Shogunate. His faithful servant gathers the 100 ryo required for his acceptance. Gengobe is also in love with a greedy geisha named Koman. About to be sold to another man, Gengobe learns that for him to keep her, her debt is exactly 100 ryo.",1971-02-13,1971,Horror
The Devil,"Young Polish nobleman Jakub is saved from imprisonment by a stranger. In return, the stranger wants to obtain a list of Jakub’s fellow conspirators. As he follows his mysterious savior across the country, Jakub is affected by the overall chaos and moral corruption; he goes insane and becomes a mass murderer.",1972-01-01,1972,Horror
Michael Jackson's Thriller,A night at the movies turns into a nightmare when Michael and his date are attacked by a hoard of bloody-thirsty zombies.,1983-11-14,1983,Horror
The Blue Elephant: Part II,A meeting with a new inmate in the psychiatric hospital flips Dr. Yehia's life upside down. She prophecies that the death of his entire family is only three days away.,2019-07-25,2019,Horror
What Ever Happened to Baby Jane?,"Two aging film actresses live as virtual recluses in an old Hollywood mansion. Jane Hudson, a successful child star, cares for her crippled sister Blanche, whose career in later years eclipsed that of Jane. Now the two live together, their relationship affected by simmering subconscious thoughts of mutual envy, hate and revenge.",1962-10-31,1962,Horror
Alien,"During its return to the earth, commercial spaceship Nostromo intercepts a distress signal from a distant planet. When a three-member team of the crew discovers a chamber containing thousands of eggs on the planet, a creature inside one of the eggs attacks an explorer. The entire crew is unaware of the impending nightmare set to descend upon them when the alien parasite planted inside its unfortunate host is birthed.",1979-05-25,1979,Horror
Threads,"Documentary style account of a nuclear holocaust and its effect on the working class city of Sheffield, England; and the eventual long run effects of nuclear war on civilization.",1984-09-23,1984,Horror
Faust,"God and Satan war over earth; to settle things, they wager on the soul of Faust, a learned and prayerful alchemist.",1926-10-13,1926,Horror
Ghost of Love,"After witnessing the brutal murder of an elderly lady, a man has an encounter with a bizarre woman who claims to be an old lover of his... A lover who apparently committed suicide years ago.",1981-04-03,1981,Horror
Ward 13,"After a car accident, Ben wakes up in hospital. Not knowing where he is or what is going on, he starts exploring the corridors...only to find that the staff don't have his health in mind! The hapless patient must pull himself together and do everything he can to escape. It's an action/horror/comedy — ending with the wheelchair chase from hell!",2003-01-01,2003,Horror
The Thing,Scientists in the Antarctic are confronted by a shape-shifting alien that assumes the appearance of the people it kills.,1982-06-25,1982,Horror
Don't Hug Me I'm Scared 6,,2016-06-19,2016,Horror
The Phantom Carriage,"It's New Year's Eve. Three drunkards evoke a legend. The legend tells that the last person to die in a year, if he is a great sinner, will have to drive during the whole year the Phantom Chariot, that picks up the souls of the dead.",1921-01-01,1921,Horror
One Cut of the Dead,"Things go badly for a hack director and film crew shooting a low budget zombie movie in an abandoned Second World War Japanese facility, when they are attacked by real zombies.",2017-11-04,2017,Horror
Diabolique,"The cruel and abusive headmaster of a boarding school, Michel Delassalle, is murdered by an unlikely duo -- his meek wife and the mistress he brazenly flaunts. The women become increasingly unhinged by a series of odd occurrences after Delassalle's corpse mysteriously disappears.",1955-01-29,1955,Horror
The Carmilla Movie,"It has been five years since Laura and Carmilla vanquished the apocalypse and Carmilla became a bonafide mortal human. They have settled in to a cozy apartment in downtown Toronto, Laura continues to hone her journalism skills while Carmilla adjusts to a non-vampire lifestyle. Their domestic bliss is suddenly ruptured when Carmilla begins to show signs of ""re-vamping"" – from a fondness for bloody treats to accidental biting – while Laura has started having bizarre, ghostly dreams. The couple must now enlist their old friends from Silas University to uncover the unknown supernatural threat and save humanity – including Carmilla's.",2017-10-26,2017,Horror
The Cabinet of Dr. Caligari,"Francis, a young man, recalls in his memory the horrible experiences he and his fiancée Jane recently went through. It is the annual fair in Holstenwall. Francis and his friend Alan visit The Cabinet of Dr. Caligari, an exhibit where the mysterious doctor shows the somnambulist Cesare, and awakens him for some moments from his death-like sleep. When Alan asks Cesare about his future, Cesare answers that he will die before dawn. The next morning Alan is found dead. Francis suspects Cesare of being the murderer, and starts spying on him and Dr. Caligari.",1920-02-25,1920,Horror
Angel's Egg,"A mysterious young girl wanders a desolate, otherworldly landscape, carrying a large egg.",1985-12-22,1985,Horror
Deep Red,"A musician witnesses the murder of a famous psychic, and then teams up with a fiesty reporter to find the killer while evading attempts on their lives by the unseen killer bent on keeping a dark secret buried.",1975-03-07,1975,Horror
The Cremator,"Kopfrkingl enjoys his job at a crematorium in Czechoslovakia in the late 1930s. He likes reading the Tibetan book of the dead, and espouses the view that cremation relieves earthly suffering.",1969-03-14,1969,Horror
Forklift Driver Klaus: The First Day on the Job,Short film depicting a fictional educational film about fork lift truck operational safety. The dangers of unsafe operation are presented in gory details.,2001-08-08,2001,Horror
Onibaba,"While her son, Kichi, is away at war, a woman and her daughter-in-law survive by killing samurai who stray into their swamp, then selling whatever valuables they find. Both are devastated when they learn that Kichi has died, but his wife soon begins an affair with a neighbor who survived the war, Hachi. The mother disapproves and, when she can't steal Hachi for herself, tries to scare her daughter-in-law with a mysterious mask from a dead samurai.",1964-11-21,1964,Horror
Kwaidan,"Taking its title from an archaic Japanese word meaning ""ghost story,"" this anthology adapts four folk tales. A penniless samurai marries for money with tragic results. A man stranded in a blizzard is saved by Yuki the Snow Maiden, but his rescue comes at a cost. Blind musician Hoichi is forced to perform for an audience of ghosts. An author relates the story of a samurai who sees another warrior's reflection in his teacup.",1964-12-29,1964,Horror
Kizumonogatari Part 1: Tekketsu,"One day, Koyomi Araragi encounters the horrifying vampire, Kiss-shot Acerola-orion Heart-under-blade A.K.A. the ""King of Apparitions."" He saves the fatally wounded Kiss-shot by offering his blood at the expense of his own life as a human. Now Koyomi has to face the vampire hunters to retrieve Kiss-shot’s limbs which were taken by these hunters...",2016-01-08,2016,Horror
The Parson's Widow,"A young man is elected by a small village to be its parson. As part of his duties, he is required to marry the widow of the parson before him. This poses two problems--first, the widow is old enough to be his grandmother, and second, he is already engaged to another woman.",1920-10-04,1920,Horror
Rosemary's Baby,A young couple moves into an infamous New York apartment building to start a family. Things become frightening as Rosemary begins to suspect her unborn baby isn’t safe around their strange neighbors.,1968-06-12,1968,Horror
Freaks,"A circus' beautiful trapeze artist agrees to marry the leader of side-show performers, but his deformed friends discover she is only marrying him for his inheritance.",1932-02-12,1932,Horror
The Hourglass Sanatorium,"A young man named Josef visits a dilapidated Sanatorium to see his father Jakob.  On his arrival, a sinister doctor informs him that his father had stopped breathing but hasn't died yet, perhaps due to Josef's arrival which may have halted time in the sanatorium.  Josef undertakes a strange journey through the many rooms of the sanatorium, each which conjures worlds composed of his memories, dreams and nightmares",1973-12-11,1973,Horror
Marble Hornets,"When a film student decides to look through the tapes of a canceled project his friend Alex had directed, and he had participated in, he discovers that his friends have been stalked by a paranormal entity known as the Operator and decides to get himself involved.",2009-06-30,2009,Horror
The Kingdom,"The first part of a Danish miniseries that has been edited into two massive films, ""Riget"" is set in the neurosurgical ward of Copenhagen's Rigshospitalet, the city and country's main hospital, nicknamed ""Riget"". The show follows a number of characters, both staff and patients, as they encounter bizarre phenomena, both human and supernatural.",1994-11-23,1994,Horror
The Hand,"A happy little potter is approached by a huge hand which wants him to sculpt its statue. The potter refuses, wanting nothing more than to be left alone with his only friend, a potted plant. As the hand's request gives way to bribery, demands, and threats, the potter becomes more desperate to escape its clutch, leading to tragedy.",1965-10-26,1965,Horror
Tales from the Gimli Hospital,"While their mother is dying in the modern Gimli, Manitoba hospital, two young children are told an important tale by their Icelandic grandmother about Ainar the lonely, his friend Gunnar, and the angelic Snjofrieder in a Gimli of old.",1988-04-15,1988,Horror
I Saw the Devil,"Kyung-chul is a dangerous psychopath who kills for pleasure. He has committed infernal serial murders in diabolic ways that one cannot even imagine and his victims range from young women to even children. The police have chased him for a long time, but were unable to catch him. One day, Joo-yeon, daughter of a retired police chief becomes his prey and is found dead in a horrific state. Her fiance Soo-hyun, a top secret agent, decides to track down the murderer himself. He promises himself that he will do everything in his power to take bloody vengeance against the killer, even if it means that he must become a monster himself to get this monstrous and inhumane killer.",2010-08-12,2010,Horror
November,"In a Medieval Estonian village, a group of peasants use magic and folk remedies to survive the winter, and a young woman tries to get a young man to love her.",2017-02-03,2017,Horror
Tumbbad,"India, 1918. On the outskirts of Tumbbad, a cursed village where it always rains, Vinayak, along with his mother and his brother, care of a mysterious old woman who keeps the secret of an ancestral treasure that Vinayak gets obsessed with.",2018-10-12,2018,Horror
Nosferatu,Vampire Count Orlok is interested in a new residence and in his real estate agent’s young wife. F. W. Murnau’s unauthorized adaptation of Bram Stoker’s “Dracula.”,1922-02-17,1922,Horror
The Wolf House,"María, a girl from Colonia Dignidad, in Chile —a kind of sectarian community, tyrannically mastered by the ruthless Paul Schäfer, a German madman, religious fanatic and child predator, who would end up turning the place into a torture center at the service of the military dictatorship ruled by Augusto Pinochet—, is punished for having lost three pigs, so she decides to run away and take refuge in an abandoned house hidden in the forest.",2018-09-21,2018,Horror
The Inugamis,"When a tycoon passes away, he unexpectedly leaves the family fortune to outsider Tamayo on the condition that she marries one of the grandsons, pitting blood against blood.",1976-10-16,1976,Horror
Possibly in Michigan,"A musical horror story about two young women who are stalked through a shopping mall by a the cannibal named Arthur. He follows them home, and here the victims become the aggressors. It is a story of friendship, courage, frailty and fears that will not go away.",1983-01-01,1983,Horror
The Tenant,"A quiet and inconspicuous man rents an apartment in France where the previous tenant committed suicide, and begins to suspect his landlord and neighbors are trying to subtly change him into the last tenant so that he too will kill himself.",1976-05-26,1976,Horror
The Unknown,A criminal on the run hides in a circus and seeks to possess the daughter of the ringmaster at any cost.,1927-06-03,1927,Horror
Train to Busan,"Martial law is declared when a mysterious viral outbreak pushes Korea into a state of emergency. Those on an express train to Busan, a city that has successfully fended off the viral outbreak, must fight for their own survival…",2016-07-20,2016,Horror
The Lighthouse,Two lighthouse keepers try to maintain their sanity while living on a remote and mysterious New England island in the 1890s.,2019-10-18,2019,Horror
Lunacy,Loosely based on two short stories by Edgar Allan Poe and inspired by the works of the Marquis de Sade. In 19th century France a young man is plagued by nightmares in which he is dragged off to a madhouse. On the journey back from his mother’s funeral he is invited by a Marquis he meets at lunch to spend the night in his castle. There he witnesses a blasphemous orgy and a ‘therapeutic’ funeral. He tries to flee but is taken to a lunatic asylum where the patients have complete freedom and the staff are locked up behind bars.,2005-11-17,2005,Horror
Strangler vs Strangler,"When it comes to crime, Belgrade is same as any other modern metropolis, except for having its own serial killers. That blank is filled when a flower salesman begins strangling women. A popular, but very disturbed rock star soon becomes telepathically connected with the killer.",1984-06-18,1984,Horror
Night of the Living Dead,A group of people try to survive an attack of bloodthirsty zombies while trapped in a rural Pennsylvania farmhouse.,1968-10-01,1968,Horror
The Testament of Dr. Mabuse,"After a detective is assaulted by thugs and placed in an asylum run by Professor Baum, he observes the professor's preoccupation with another patient, the criminal genius Dr. Mabuse the hypnotist. When Mabuse's notes are found to be connected with a rash of recent crimes, Commissioner Lohmann must determine how Mabuse is communicating with the criminals, despite conflicting reports on the doctor's whereabouts, and capture him for good.",1933-04-21,1933,Horror
"Dr. Mabuse, the Gambler","Arch-criminal Dr. Mabuse, who is a master of disguise and has been hypnotising people into doing his bidding, sets out to make a fortune and run Berlin. Detective Wenk sets out to stop him.",1922-04-27,1922,Horror
King Kong,"A film crew discovers the ""eighth wonder of the world,"" a giant prehistoric ape, and brings him back to New York, where he wreaks havoc.",1933-03-15,1933,Horror
The Exorcist,"12-year-old Regan MacNeil begins to adapt an explicit new personality as strange events befall the local area of Georgetown. Her mother becomes torn between science and superstition in a desperate bid to save her daughter, and ultimately turns to her last hope: Father Damien Karras, a troubled priest who is struggling with his own faith.",1973-12-26,1973,Horror
Frankenstein: The True Story,"This much-requested, made-for-TV adaptation of Mary Shelley's novel stars Michael Sarrazin as the creature given life by Victor Frankenstein (Leonard Whiting), who witnesses his creation turn uncontrollable after he's duped by his associate, Dr. Polidori (James Mason). David McCallum, Jane Seymour, Ralph Richardson, John Gielgud and Tom Baker also star.",1973-11-28,1973,Horror
Alice,"A quiet young English girl named Alice finds herself in an alternate version of her own reality after chasing a white rabbit. She becomes surrounded by living inanimate objects and stuffed dead animals, and must find a way out of this nightmare- no matter how twisted or odd that way must be. A memorably bizarre screen version of Lewis Carroll’s novel ‘Alice’s Adventures in Wonderland’.",1988-08-03,1988,Horror
Don't Hug Me I'm Scared,A disturbing puppet short exploring the concept of creativity.,2011-07-25,2011,Horror
Jaws,"When an insatiable great white shark terrorizes the townspeople of Amity Island, the police chief, an oceanographer and a grizzled shark hunter seek to destroy the blood-thirsty beast.",1975-06-18,1975,Horror
Cigarette Burns,"With a torrid past that haunts him, a movie theatre owner is hired to search for the only existing print of a film so notorious that its single screening caused the viewers to become homicidally insane.",2005-12-16,2005,Horror
Morgiana,"Jealous of her vapidly ""good"" sister's popularity, poisonous Viktoria doses pretty Klara's tea with a slow-acting fatal substance. As the latter grows hysterically weak, the former finds success increasingly compromised by guilt, blackmail, and the pesky need to kill others lest she be exposed.",1972-09-15,1972,Horror
Don't Torture a Duckling,A reporter and a promiscuous young woman try to solve a series of child killings in a remote southern Italian town rife with superstition and a distrust of outsiders.,1972-09-29,1972,Horror
Peeping Tom,"Loner Mark Lewis works at a film studio during the day and, at night, takes racy photographs of women. Also he's making a documentary on fear, which involves recording the reactions of victims as he murders them. He befriends Helen, the daughter of the family living in the apartment below his, and he tells her vaguely about the movie he is making. She sneaks into Mark's apartment to watch it and is horrified by what she sees -- especially when Mark catches her.",1960-04-06,1960,Horror
What We Do in the Shadows,Vampire housemates try to cope with the complexities of modern life and show a newly turned hipster some of the perks of being undead.,2014-06-19,2014,Horror
Eraserhead,"Henry Spencer tries to survive his industrial environment, his angry girlfriend, and the unbearable screams of his newly born mutant child.",1977-03-19,1977,Horror
Black Swan,A journey through the psyche of a young ballerina whose starring role as the duplicitous swan queen turns out to be a part for which she becomes frighteningly perfect.,2010-12-03,2010,Horror
Hour of the Wolf,"An artist in crisis is haunted by nightmares from the past in Ingmar Bergman's only horror film, which takes place on a windy island. During ""the hour of the wolf"" - between midnight and dawn - he tells his wife about his most painful memories.",1968-02-19,1968,Horror
The Rocky Horror Picture Show,"Sweethearts Brad and Janet, stuck with a flat tire during a storm, discover the eerie mansion of Dr. Frank-N-Furter, a transvestite scientist. As their innocence is lost, Brad and Janet meet a houseful of wild characters, including a rocking biker and a creepy butler. Through elaborate dances and rock songs, Frank-N-Furter unveils his latest creation: a muscular man named 'Rocky'.",1975-08-14,1975,Horror
Don't Hug Me I'm Scared 4,The fourth instalment in the surreal Don’t Hug Me I’m Scared videos in which the three returning characters enter a sinister digital world through their computer.,2015-03-31,2015,Horror
Eyes Without a Face,"Dr. Génessier is riddled with guilt after an accident that he caused disfigures the face of his daughter, the once beautiful Christiane, who outsiders believe is dead. Dr. Génessier, along with accomplice and laboratory assistant Louise, kidnaps young women and brings them to the Génessier mansion. After rendering his victims unconscious, Dr. Génessier removes their faces and attempts to graft them on to Christiane's.",1960-01-11,1960,Horror
Evil Dead II,"Ash Williams and his girlfriend Linda find a log cabin in the woods with a voice recording from an archeologist who had recorded himself reciting ancient chants from ""The Book of the Dead."" As they play the recording an evil power is unleashed taking over Linda's body.",1987-03-13,1987,Horror
Soldiers Of The Damned,"WWII German soldiers take an occult scientist into a haunted forest in Romania, only to be confronted by their own ghosts.",2017-12-07,2017,Horror
Swallow,"Hunter, a newly pregnant housewife, finds herself increasingly compelled to consume dangerous objects. As her husband and his family tighten their control over her life, she must confront the dark secret behind her new obsession.",2020-01-15,2020,Horror
An Evening of Edgar Allan Poe,"A collection of 4 Poe stories narrated by Vincent Price: 1) The Telltale Heart, 2) Pit and the Pendulum, 3) The Sphinx, and 4) The Cask of Amontillado.",1970-01-01,1970,Horror
Phantom of the Paradise,"In this rock opera hybrid of Phantom of the Opera and Faust, fledgling singer-songwriter Winslow Leach finds himself double-crossed by the nefarious music producer Swan, who steals both his music and the girl Leach wants to sing it, Phoenix, for the grand opening of his rock palace, The Paradise. After Swan sends Leach to prison for trespassing, Leach endures a freak accident which leaves him disfigured and plans his revenge on both Swan and The Paradise, becoming the Phantom of the Paradise.",1974-10-31,1974,Horror
Suspiria,"From the moment she arrives in Freiberg, Germany, to attend the prestigious Tanz Academy, American ballet-dancer Suzy Bannion senses that something horribly evil lurks within the walls of the age-old institution.",1977-02-01,1977,Horror
The Others,"Grace is a religious woman who lives in an old house kept dark because her two children, Anne and Nicholas, have a rare sensitivity to light. When the family begins to suspect the house is haunted, Grace fights to protect her children at any cost in the face of strange events and disturbing visions.",2001-08-02,2001,Horror
Mother Joan of the Angels,A priest is sent to a small parish in the Polish countryside which is believed to be under demonic possession and there he finds his own temptations awaiting.,1961-02-09,1961,Horror
Don't Hug Me I'm Scared 2: TIME,Step back into the imaginative and frankly terrifying world of Becky & Joe with Don’t Hug Me I’m Scared. In this episode: Some things change over Time.,2014-01-08,2014,Horror
The Skin I Live In,A brilliant plastic surgeon creates a synthetic skin that withstands any kind of damage. His guinea pig: a mysterious and volatile woman who holds the key to his obsession.,2011-08-17,2011,Horror
The Backwater Gospel,Backwater is doomed by the regular visits of the undertaker and its dwellers blame a tramp.,2011-01-01,2011,Horror
